{
  "envelope_id": "aae-2026-10-27-0002",
  "agent_id": "containment-agent",
  "issued_at": "2026-10-27T14:05:00Z",
  "expires_at": "2099-10-27T14:06:00Z",
  "action": {
    "type": "isolate_edge_node",
    "target": "edge-node-12",
    "parameters": {"preserve_management_plane": true}
  },
  "authority": {
    "scope": ["action:isolate_edge_node", "resource:edge-node-12"],
    "delegated_by": "security-orchestrator",
    "delegation_depth": 1,
    "revocable": true
  },
  "risk": {"level": "high"},
  "approval": {"mode": "quorum", "quorum_required": 2, "approvals": ["policy-engine-a", "policy-engine-b"]},
  "policy": {"policy_set": "critical-edge-containment", "policy_version": "sha256:b71fdemo"},
  "attestation": {"required": true, "measurement": "tpm://edge-node-12/pcr/baseline-77"},
  "verification": {
    "required_checks": ["authorization", "target_correctness", "reachability", "availability", "blast_radius", "effectiveness", "rollback_readiness"],
    "passed_checks": ["authorization", "target_correctness", "reachability", "availability", "blast_radius", "effectiveness", "rollback_readiness"],
    "max_age_seconds": 10,
    "evidence_age_seconds": 4,
    "digital_twin_required": true
  },
  "recovery": {"rollback_supported": true, "rollback_action": "restore_edge_node_connectivity"},
  "provenance": {
    "evidence_refs": ["telemetry://edge-node-12/edr/evt-2207", "digital-twin://simulation/sim-441"],
    "correlation_id": "incident-2026-1051"
  },
  "revoked": false
}
