{
  "envelope_id": "aae-2026-10-27-0001",
  "agent_id": "network-defense-agent",
  "issued_at": "2026-10-27T14:00:00Z",
  "expires_at": "2099-10-27T14:02:00Z",
  "action": {
    "type": "block_source_ip",
    "target": "edge-gateway-a",
    "parameters": {"source_ip": "203.0.113.45", "ttl_seconds": 900}
  },
  "authority": {
    "scope": ["action:block_source_ip", "resource:edge-gateway-a"],
    "delegated_by": null,
    "delegation_depth": 0,
    "revocable": true
  },
  "risk": {"level": "medium"},
  "approval": {"mode": "automatic", "quorum_required": 0, "approvals": []},
  "policy": {"policy_set": "edge-defense", "policy_version": "sha256:9a12demo"},
  "attestation": {"required": false, "measurement": null},
  "verification": {
    "required_checks": ["authorization", "target_correctness", "blast_radius", "policy"],
    "passed_checks": ["authorization", "target_correctness", "blast_radius", "policy"],
    "max_age_seconds": 30,
    "evidence_age_seconds": 8,
    "digital_twin_required": false
  },
  "recovery": {"rollback_supported": true, "rollback_action": "remove_firewall_rule"},
  "provenance": {
    "evidence_refs": ["telemetry://edge-a/auth-failures/evt-991", "threat-intel://indicator/203.0.113.45"],
    "correlation_id": "incident-2026-1042"
  },
  "revoked": false
}
